9.Perform following SQL queries on the database:
• Pattern matching
• Arithmetic operations and built in functions

mysql> USE QUES9;
mysql> CREATE DATABASE COLLEGE;
Query OK, 1 row affected (0.00 sec)

mysql> USE COLLEGE;
Database changed
mysql>
mysql> CREATE TABLE STUDENT(ROLL_NO INT , NAME VARCHAR(20) , MARKS INT);
Query OK, 0 rows affected (0.01 sec)

mysql>
mysql> INSERT INTO STUDENT VALUES(1 , 'VIVEK' , 75);
Query OK, 1 row affected (0.04 sec)

mysql>
mysql> INSERT INTO STUDENT VALUES(2 , 'ASHUTOSH' , 80);
Query OK, 1 row affected (0.00 sec)

mysql>
mysql> INSERT INTO STUDENT VALUES(3 , 'TUSHAR' , 77);
Query OK, 1 row affected (0.00 sec)

mysql>
mysql> INSERT INTO STUDENT VALUES(4 , 'SHASHWAT' , 74);
Query OK, 1 row affected (0.00 sec)

mysql>
mysql> ALTER TABLE STUDENT ADD PRIMARY KEY(ROLL_NO);
Query OK, 0 rows affected (0.04 sec)
Records: 0  Duplicates: 0  Warnings: 0

mysql> /*Pattern Matching*/

mysql> SELECT * FROM STUDENT;
+---------+----------+-------+
| ROLL_NO | NAME     | MARKS |
+---------+----------+-------+
|       1 | VIVEK    |    75 |
|       2 | ASHUTOSH |    80 |
|       3 | TUSHAR   |    77 |
|       4 | SHASHWAT |    74 |
+---------+----------+-------+
4 rows in set (0.00 sec)

mysql>
mysql> SELECT * FROM STUDENT WHERE ROLL_NO IN(1,4);
+---------+----------+-------+
| ROLL_NO | NAME     | MARKS |
+---------+----------+-------+
|       1 | VIVEK    |    75 |
|       4 | SHASHWAT |    74 |
+---------+----------+-------+
2 rows in set (0.00 sec)

mysql>
mysql> SELECT * FROM STUDENT WHERE NAME LIKE 'V%';
+---------+-------+-------+
| ROLL_NO | NAME  | MARKS |
+---------+-------+-------+
|       1 | VIVEK |    75 |
+---------+-------+-------+
1 row in set (0.00 sec)

mysql>
mysql> SELECT ROLL_NO FROM STUDENT GROUP BY ROLL_NO;
+---------+
| ROLL_NO |
+---------+
|       1 |
|       2 |
|       3 |
|       4 |
+---------+
4 rows in set (0.00 sec)

mysql>
mysql> SELECT  NAME, MARKS FROM STUDENT GROUP BY NAME, MARKS HAVING MARKS<90;
+----------+-------+
| NAME     | MARKS |
+----------+-------+
| ASHUTOSH |    80 |
| SHASHWAT |    74 |
| TUSHAR   |    77 |
| VIVEK    |    75 |
+----------+-------+
4 rows in set (0.00 sec)

mysql>
mysql> SELECT * FROM STUDENT ORDER BY NAME;
+---------+----------+-------+
| ROLL_NO | NAME     | MARKS |
+---------+----------+-------+
|       2 | ASHUTOSH |    80 |
|       4 | SHASHWAT |    74 |
|       3 | TUSHAR   |    77 |
|       1 | VIVEK    |    75 |
+---------+----------+-------+
4 rows in set (0.00 sec)

mysql>
mysql> SELECT * FROM STUDENT ORDER BY NAME DESC;
+---------+----------+-------+
| ROLL_NO | NAME     | MARKS |
+---------+----------+-------+
|       1 | VIVEK    |    75 |
|       3 | TUSHAR   |    77 |
|       4 | SHASHWAT |    74 |
|       2 | ASHUTOSH |    80 |
+---------+----------+-------+
4 rows in set (0.00 sec)

mysql> CREATE TABLE STUDENT2(ROLL_NO INT PRIMARY KEY , NAME VARCHAR(30) ,MARKS INT, DOB DATE  );
Query OK, 0 rows affected (0.01 sec)

mysql>
mysql> INSERT INTO STUDENT2 VALUES(91 , 'RAM' , 90 , '2005-01-01'  );
Query OK, 1 row affected (0.00 sec)

mysql> INSERT INTO STUDENT2 VALUES(92 , 'SHAM' ,91, '2005-02-02'  );
Query OK, 1 row affected (0.00 sec)

mysql> INSERT INTO STUDENT2 VALUES(93 , 'KARAN' ,92, '2005-03-03' );
Query OK, 1 row affected (0.00 sec)

mysql> INSERT INTO STUDENT2 VALUES(94 , 'ARJUN' , 93 ,'2005-04-04' );
Query OK, 1 row affected (0.00 sec)

mysql>
mysql> SELECT * FROM STUDENT2;
+---------+-------+-------+------------+
| ROLL_NO | NAME  | MARKS | DOB        |
+---------+-------+-------+------------+
|      91 | RAM   |    90 | 2005-01-01 |
|      92 | SHAM  |    91 | 2005-02-02 |
|      93 | KARAN |    92 | 2005-03-03 |
|      94 | ARJUN |    93 | 2005-04-04 |
+---------+-------+-------+------------+
4 rows in set (0.00 sec)

mysql>
mysql> SELECT * FROM STUDENT UNION SELECT * FROM STUDENT2;
ERROR 1222 (21000): The used SELECT statements have a different number of columns
mysql>  ALTER TABLE STUDENT2
    -> DROP COLUMN  DOB;
Query OK, 0 rows affected (0.01 sec)
Records: 0  Duplicates: 0  Warnings: 0

mysql> SELECT * FROM STUDENT UNION SELECT * FROM STUDENT2;
+---------+----------+-------+
| ROLL_NO | NAME     | MARKS |
+---------+----------+-------+
|       1 | VIVEK    |    75 |
|       2 | ASHUTOSH |    80 |
|       3 | TUSHAR   |    77 |
|       4 | SHASHWAT |    74 |
|      91 | RAM      |    90 |
|      92 | SHAM     |    91 |
|      93 | KARAN    |    92 |
|      94 | ARJUN    |    93 |
+---------+----------+-------+
8 rows in set (0.00 sec)

mysql>
mysql> SELECT * FROM STUDENT ORDER BY NAME;
+---------+----------+-------+
| ROLL_NO | NAME     | MARKS |
+---------+----------+-------+
|       2 | ASHUTOSH |    80 |
|       4 | SHASHWAT |    74 |
|       3 | TUSHAR   |    77 |
|       1 | VIVEK    |    75 |
+---------+----------+-------+
4 rows in set (0.00 sec)

mysql>
mysql> SELECT * FROM STUDENT ORDER BY NAME DESC;
+---------+----------+-------+
| ROLL_NO | NAME     | MARKS |
+---------+----------+-------+
|       1 | VIVEK    |    75 |
|       3 | TUSHAR   |    77 |
|       4 | SHASHWAT |    74 |
|       2 | ASHUTOSH |    80 |
+---------+----------+-------+
4 rows in set (0.00 sec)

mysql> /*ARITHMETIC OPERATIONS*/

mysql> SELECT * FROM STUDENT;
+---------+----------+-------+
| ROLL_NO | NAME     | MARKS |
+---------+----------+-------+
|       1 | VIVEK    |    75 |
|       2 | ASHUTOSH |    80 |
|       3 | TUSHAR   |    77 |
|       4 | SHASHWAT |    74 |
+---------+----------+-------+
4 rows in set (0.00 sec)

mysql>
mysql> UPDATE STUDENT SET MARKS = MARKS + 20 WHERE ROLL_NO = 1;
Query OK, 1 row affected (0.00 sec)
Rows matched: 1  Changed: 1  Warnings: 0

mysql>
mysql> UPDATE STUDENT SET MARKS = MARKS + 25 WHERE ROLL_NO = 2;
Query OK, 1 row affected (0.00 sec)
Rows matched: 1  Changed: 1  Warnings: 0

mysql>
mysql> SELECT ROLL_NO, NAME, SQRT(MARKS) AS SQUARE_ROOT_MARKS FROM STUDENT;
+---------+----------+--------------------+
| ROLL_NO | NAME     | SQUARE_ROOT_MARKS  |
+---------+----------+--------------------+
|       1 | VIVEK    |  9.746794344808963 |
|       2 | ASHUTOSH | 10.246950765959598 |
|       3 | TUSHAR   |  8.774964387392123 |
|       4 | SHASHWAT |  8.602325267042627 |
+---------+----------+--------------------+
4 rows in set (0.00 sec)

mysql>
mysql> SELECT MAX(MARKS) AS MAXIMUM_MARKS FROM STUDENT;
+---------------+
| MAXIMUM_MARKS |
+---------------+
|           105 |
+---------------+
1 row in set (0.00 sec)

mysql>
mysql> SELECT COUNT(*) AS NUM_STUDENTS FROM STUDENT;
+--------------+
| NUM_STUDENTS |
+--------------+
|            4 |
+--------------+
1 row in set (0.00 sec)

mysql>
mysql> SELECT * FROM STUDENT;
+---------+----------+-------+
| ROLL_NO | NAME     | MARKS |
+---------+----------+-------+
|       1 | VIVEK    |    95 |
|       2 | ASHUTOSH |   105 |
|       3 | TUSHAR   |    77 |
|       4 | SHASHWAT |    74 |
+---------+----------+-------+
4 rows in set (0.00 sec)






